title,score,id,subreddit,url,num_comments,body,created
WELCOME - PLEASE READ before commenting or posting!,26,gcn33u,BodyAcceptance,https://www.reddit.com/r/BodyAcceptance/comments/gcn33u/welcome_please_read_before_commenting_or_posting/,0,"###Thank you for joining us.  

The world tells us that we all must look a certain way, with images
and ideals that are unrealistic, existing only for the tiniest
fraction of humanity.  We are all imperfect in at least one way, and
that's what makes us unique.

This sub is about accepting people how they are today, without
pressure to think that they should change.


---
**Feeling bad or uncomfortable with your body?** That should go on the Bi-Weekly Body Dissatisfaction Post, which is posted on Monday and Thursday.  [Why? Click here.](https://www.reddit.com/r/BodyAcceptance/wiki/daily-dissatisfaction) 

Posts that belong on the Body Dissatisfaction post will be removed and redirected.

---



####[**Please follow our rules**](https://www.reddit.com/r/BodyAcceptance/wiki/rules). 
Breaking these rules can get you a warning, a temporary ban, or a permanent ban.

#####The most commonly broken rules are:

o **This is not a weight loss/gain support sub.**  Posts or comments that are positive, encouraging, or supportive of weight changes are not allowed.

o **Do not give body size measurements.**  Exceptions are for height, and for clothing and bra sizes.

o **Do not post selfies, body shots, or videos.** They tend to solicit judgement-based comments. Everyone is accepted here as they are.

o **No rude, inflammatory, or prurient language.**  That includes your preference in attractiveness, and your ""facts"" about health. 

**[There are other rules.](https://www.reddit.com/r/BodyAcceptance/wiki/rules)** Make sure to read them all.


---

####**[We have a Wiki](https://www.reddit.com/r/BodyAcceptance/wiki/index)**.


The Wiki includes a list of [some related subs](https://www.reddit.com/r/BodyAcceptance/wiki/othersubs) which may be more help for your specific issue or better answer your question.  It also contains [lists of books, articles, and websites that address specific issues](https://www.reddit.com/r/BodyAcceptance/wiki/gallerylinks) as well as [suggested social media accounts](https://www.reddit.com/r/BodyAcceptance/wiki/socialmedia).

If you have ideas for things that we might add you can [message the
moderators](https://www.reddit.com/message/compose/?to=/r/BodyAcceptance&Subject:Wiki suggestion).

---

---

**Due to repeated problems, those who post to subs that promote ideals
  counter to this sub may be banned without warning.**

You may appeal this ban but you will need to prove you will follow our rules.",1588494107.0
"Bi-weekly Body Dissatisfaction Post - February 17, 2022",3,sujhbe,BodyAcceptance,https://www.reddit.com/r/BodyAcceptance/comments/sujhbe/biweekly_body_dissatisfaction_post_february_17/,7,"**Welcome to the r/BodyAcceptance Bi-weekly Body Dissatisfaction Post** for talking about your negative feelings about your body.  This post will be created on Mondays and Thursdays.

As this is a support sub, people may offer advice. If you would prefer to rant without getting advice, please start your comment with [RANT ONLY]. Others are asked to respect that the commenter does not want advice.

**Important: [Please read if you're feeling suicidal or that you may harm yourself](https://www.reddit.com/r/BodyAcceptance/wiki/about-suicide-talk).** 

[Why does this post exist?](https://www.reddit.com/r/BodyAcceptance/wiki/daily-dissatisfaction)

**All comments must follow [the rules of this sub](https://www.reddit.com/r/BodyAcceptance/wiki/rules).**",1645084811.0
"Inspiration Sunday - February 20, 2022",3,sww5nw,BodyAcceptance,https://www.reddit.com/r/BodyAcceptance/comments/sww5nw/inspiration_sunday_february_20_2022/,0,"**What has inspired you recently?**

Is it a person, some art, some social media, a tv show, or something else?  Share it with us!

**You are welcome to post images, but note that they will automatically be held for moderator review and will be handled as quickly as possible.**

*As always, comments must follow the rules of this sub, including the rule of no selfies or body pictures.  Comments that break the rules will be removed.*",1645344017.0
"Feel Good Friday - February 18, 2022",3,svcjrq,BodyAcceptance,https://www.reddit.com/r/BodyAcceptance/comments/svcjrq/feel_good_friday_february_18_2022/,0,"**This is our weekly Feel Good Friday post.**

Tell us about what's made you feel good this week. What's put a smile on your face? What's boosted your confidence?  

*As always, comments must follow the rules of this sub. Comments that break the rules will be removed.*",1645171211.0
Words of wisdom,6,sugt8n,BodyAcceptance,https://www.reddit.com/r/BodyAcceptance/comments/sugt8n/words_of_wisdom/,0,"Hi there! I wrote some words of wisdom (which is a senior tradition in my sorority) about body acceptance, and I really want to share them with a wider audience and thought this sub would be a good place! here goes..

**M's Declassified Body Positivity Survival Guide**

Trigger warning, I will obviously be talking about body image and will briefly mention eating disorders so if this is something that will make you uncomfortable please feel free to click away

To launch into this, I want to ask, has your body image ever stopped you from doing anything ever?  From wearing a cute top that you like, to having a yummy snack, to feeling confident enough to walk up and talk to someone? Can you imagine how much joy you’ve missed out on because you have been limiting your actions based on something that doesn’t ACTUALLY affect how you are allowed to curate your lived experience? You all deserve to live your life joyously and unconstrained by insecurity, so here are my top 10 tips on body positivity.

1. You don’t give a fuck about anyone else, so no one gives a fuck about you.
   1. Do you ever walk down the corner and worry that you look stupid? Do you realize that a lot of other people are also actually worrying about that for themselves at the same time? Take solidarity in this shared lived experience and realize that everyone is too concerned with themselves to be concerned with what you look like or what you are doing. I’m sure the amount of times you walk down the corner and mentally compliment someone is far greater than the amount of times you mentally judge someone. 
2. If you can love others, why can’t you love yourself?
   1. If you can look at someone else and decouple their worth from how their body looks, why can’t you do that for yourself? 
   2. I’m sure you find people of all shapes and sizes different from your own beautiful. I’m sure you find people with the exact same body type as yours beautiful. You deserve to afford yourself the same grace and aesthetic appreciation as you would afford literally anyone else.  
3. Consider how the beauty industry is founded in capitalism
   1. All traditional beauty companies in the market really want is to manipulate your perception of yourself so that they can convince you to buy things and profit off of your insecurity. 
   2. Have you ever developed an insecurity or worry that you didn’t even have until an advertisement told you that you should have it? Imagine how much better our lives would be if we weren’t constantly bombarded by advertisements related to the beauty industry. The beauty industry is built on comparison and the bet that what they show is something that you wish you could have 
   3. Think critically about how advertisements are trying to make you wish you were different, just so they can sell you something. Often, they are attempting to convince you that what they sell to you  an ideal reality when they really they just sell a product you will waste your money on and actually will make you feel worse about yourself
   4. The capitalistic beauty industry also needs change in order to push new products and continue to make money. This is why beauty standards are constantly changing. The fact that beauty standards are constantly changing also is great proof that every moment you spend trying to shape yourself and your image in a certain way that is deemed attractive can so quickly go to waste as soon as the trend changes, so you might as well just learn to love the body you have now. 
4. Remember that everything is not as it seems 
   1. \*Cue the wizards of Waverly place soundtrack\*
   2. SOCIAL MEDIA AND ADVERTISEMENTS ARE SO EASILY MANIPULATED, AND MANIPULATED SO WELL THAT IT SEEMS REALISTIC THESE DAYS 
   3. However, so few of the images put out in the market by large corporations are un-retouched. 
   4. Trust nothing, be critical. 
   5. Remember this especially when scrolling through social media as high quality retouching is accessible to everyone now with face-tune 
   6. On that note, I highly, highly, HIGHLY recommend weaning yourself off of face-tune. Enhancing colors and brightness in photos is fine, but fundamentally changing something about your body through editing and filters is damaging to your own self image as well as the mindsets of those who consume your content. 
   7. Speaking of social media…
5. diversify your feed
   1. Intentionally follow people that look like you, follow people that don’t look like you on both ends of the spectrum
   2. In all ways, including in the bodies you see 
      1. Race, ethnicity, gender identity and expression, size!
   3. I also think it is important to de-aspirational your feed
      1. Do not follow “fit-spiration” accounts 
      2. Do not follow people that you only follow out of envy 
      3. Spending hours on social media scrolling through images of what you wish you were does nothing but hurt your self image.
   4. I think this is a good place to mention men’s body positivity and the double standards surrounding them is something to consider when orienting yourself in the world of body positivity. I also think it is important to acknowledge that people with gender differences and dysphoria have varying levels of body-image related issues as well and that this is not just a straight-white-female problem.
6. Analyze the decisions you’re making in relation to your body 
   1. Are you working out because it makes you feel good and will help you live longer, or are you working out to look a certain way? 
   2. Are you choosing it because it will fuel your body in the way that you need it to, as well as taste yummy, or are you choosing a certain snack or meal because it will change how your body looks?
   3. Are you putting on that outfit because you like it and it expresses your tastes, or are you putting it on because it shapes your body to fit a certain popular beauty standard
   4. Looking more deeply into these decisions can help you better understand how to dismantle your own negative self perception and tendencies. 
7. Physically treat your body with kindness 
   1. Instead of pinching or rubbing or poking at the parts of your body that you don’t like, when was the last time you lovingly and tenderly touched them? Physical actions can help shape our thoughts 
   2. Do not wear tight and uncomfortable clothes for any longer than you truly want to! Take that bra off when you get home! Peel yourself out of those jeans! 
   3. Speaking of clothes, clothes are made to fit your body, you do not need to make your body fit the clothes. You do not need to lose weight to be worthy of wearing any type of clothing. Do not hold onto clothing that no longer fits in the hope for motivation to change. Do not buy clothing as motivation to change. Buy and keep what fits now. 
   4. Rest when you need rest. If you think working out is beyond your mental energy scope for the day, then it is ok to skip a day. Muscles are not built overnight, nor are they lost overnight. 
   5. Eat when you are hungry. So often boys are encouraged to eat a lot when they are young because they are “growing boys” but women are introduced to diet culture at a scary young age through the media. Food is essential for survival. Beyond that, food is a source of joy. You need to eat. You are allowed to eat for joy, not just for survival.
   6. Thank your body for everything that it has done for you. This is the only one you get. Thank her for every happy experience she has allowed you to participate in, and thank her for every hard one that she has carried you through. Your body is your ally, not your enemy. 
8. Raise your standards, lower your expectations for everyone, including yourself
   1. This piece of advice I mostly apply to dating and relationships and I could do a whole words of wisdom on this alone, but also can apply to your relationship with your body 
   2. If you wouldn’t let your best friend talk a certain way about your body, why would you let yourself? Would you go back in time and say the nasty things you say to your younger self?
   3. Also be kind to yourself on your body positivity journey. It is its own version of a mindfulness practice. notice the negative automatic thoughts, identify what they are and where they are coming from, and correct them, and thank yourself for choosing to be kind to yourself. These thought habits have been built over two whole decades and will take time to dismantle and reassemble. Like Ikea furniture.
9. On a serious note, Seek professional help if you think you need it
   1. Disordered eating is a serious issue and everyone struggling with it deserves love, compassion, and help. If you think you are struggling with disordered eating, please seek professional help
10. IF BODY POSITIVITY SEEMS TOO FAR OUT OF YOUR REALM, GO FOR BODY NEUTRALITY 
   1. Body neutrality is often defined as the idea that you can exist without having to think too much about your body one way or another, positive or negative. You can simply exist and be worthy of respect without thinking about your body at all.
   2. I personally think both body positivity and neutrality can and should be practiced in unison
   3. This also is important as it is important to decouple your worth and anyone’s worth from their body and relationship with it
   4. Your body is the least interesting thing about you. You are a strong, smart, talented, vivacious, interesting person on your own, and how you look has exactly ZERO bearing on that. 
   5. In contrast to that, there is a forced separation we so often create between mind and body. The body is not just a vessel for your thoughts, it is your conduit for your lived experience, it is how you interact with the world. Be grateful for YOU, but also realize that the aesthetic aspects of your body should not shape your relationship with it.  
   6. A final question on this note.. Do you really want to spend the rest of your life unhappily chasing a standard rather than accepting the body that you live in? This is not to guilt you for wanting to change, but I think provides some perspective on what is truly important in life.

I’ll conclude by saying this– body positivity and/or body neutrality is hard. So hard. I am still unlearning the toxicity shoved into our brains over our whole lives. Every day is a struggle. But every day is a chance to fight to love yourself, because you deserve it. You deserve to wear that crop top or tight dress, you deserve to get that ice cream on a hot summer’s day, you are a damn catch and any friend or romantic interest would be lucky to have you, and you deserve to go through life without constantly being weighed down by constant awareness and negative perceptions of your body. Go confidently, and be kind to yourself, and be kind to your body.",1645075085.0
"""Body Love"" by Mary Lambert - Danced and Choreographed by Amanda LaCount",2,su41sx,BodyAcceptance,https://youtu.be/PO5izQ2ADKU,1,,1645039527.0
"Weekly Recommend/Request Media Post - February 16, 2022",3,strmd1,BodyAcceptance,https://www.reddit.com/r/BodyAcceptance/comments/strmd1/weekly_recommendrequest_media_post_february_16/,1,"Want to find social media accounts that are supportive? Have a suggestion for other types of media related to body acceptance?  Post them here.

You can look on our wiki [here for social media accounts](https://www.reddit.com/r/BodyAcceptance/wiki/socialmedia) and [here for other media suggestions](https://www.reddit.com/r/BodyAcceptance/wiki/gallerylinks).  Any suggestions made on these posts will be added to the lists.",1645002913.0
My breast makes me uncomfortable???,19,sskwcu,BodyAcceptance,https://www.reddit.com/r/BodyAcceptance/comments/sskwcu/my_breast_makes_me_uncomfortable/,9,"Ok so, I don't know if anybody else has ever felt this way but recently when i go on about my day without having my bra on or whatever, i can almost ""feel"" my breast. It drives me crazy. Like I can clearly feel its weight etc. Given that I have medium-sized boobs (C cup), this felt very strange, but I'm asking for reassurance for clarifying if this is a normal experience. Maybe It's a hormonal shift making me feel more aware of it? I'm kind of clueless.",1644871589.0
"Grateful & GratiTuesday - February 15, 2022",2,ssxswt,BodyAcceptance,https://www.reddit.com/r/BodyAcceptance/comments/ssxswt/grateful_gratituesday_february_15_2022/,0,"**Welcome to our weekly Grateful & GratiTuesday post.**

What are you grateful for?

What about your body brings you gratitude and joy?

What in your life helps you achieve body acceptance?

Share your thoughts!  

*(As always, all comments must follow [the rules of this sub](https://www.reddit.com/r/BodyAcceptance/wiki/rules). Comments that break the rules will be removed.)*",1644912016.0
"Bi-Weekly Body Dissatisfaction Post - February 14, 2022",2,ss5c3g,BodyAcceptance,https://www.reddit.com/r/BodyAcceptance/comments/ss5c3g/biweekly_body_dissatisfaction_post_february_14/,7,"**Welcome to the r/BodyAcceptance Bi-weekly Body Dissatisfaction Post** for talking about your negative feelings about your body.  This post will be created on Mondays and Thursdays.

As this is a support sub, people may offer advice. If you would prefer to rant without getting advice, please start your comment with [RANT ONLY]. Others are asked to respect that the commenter does not want advice.

**Important: [Please read if you're feeling suicidal or that you may harm yourself](https://www.reddit.com/r/BodyAcceptance/wiki/about-suicide-talk).** 

[Why does this post exist?](https://www.reddit.com/r/BodyAcceptance/wiki/daily-dissatisfaction)

**All comments must follow [the rules of this sub](https://www.reddit.com/r/BodyAcceptance/wiki/rules).**",1644825613.0
Reminder: Negative posts about your body go on the bi-weekly Body Dissatisfaction post,21,srhgdk,BodyAcceptance,https://www.reddit.com/r/BodyAcceptance/comments/srhgdk/reminder_negative_posts_about_your_body_go_on_the/,0,"People on this sub said that ""this sub is nothing but negative posts"" and requested that negative-feeling posts get grouped together.  That's why there is a bi-weekly Body Dissatisfaction post, which are automatically created on Mondays and Thursdays.

Once one negative post slips through the cracks, there are suddenly piles more that start to show up.

**All posts about feeling negative about our bodies will be removed  and people redirected to the bi-weekly post.**  You can post on the bi-weekly posts at any time, not just on those specific days.

We can't have it both ways.  Either this sub is mostly people talking about hating their bodies or people use the bi-weekly posts.",1644754719.0
"Inspiration Sunday - February 13, 2022",2,srdkqm,BodyAcceptance,https://www.reddit.com/r/BodyAcceptance/comments/srdkqm/inspiration_sunday_february_13_2022/,0,"**What has inspired you recently?**

Is it a person, some art, some social media, a tv show, or something else?  Share it with us!

**You are welcome to post images, but note that they will automatically be held for moderator review and will be handled as quickly as possible.**

*As always, comments must follow the rules of this sub, including the rule of no selfies or body pictures.  Comments that break the rules will be removed.*",1644739217.0
"body acceptance is part of it, but I'm looking for more general self love tips - any advice?",21,sqwlf1,BodyAcceptance,https://www.reddit.com/r/BodyAcceptance/comments/sqwlf1/body_acceptance_is_part_of_it_but_im_looking_for/,11,"I have a lot of self hatred and self loathing

I don't want to be this way anymore.

I realize I have some issues with my body and those need to be addressed, but I would more like to address the mental illness that underlies my hatred of both body and self

any tips/subreddits/reading/advice?

I'm in therapy",1644687005.0
I looked at my past self and it’s making things hard,16,sqxahu,BodyAcceptance,https://www.reddit.com/r/BodyAcceptance/comments/sqxahu/i_looked_at_my_past_self_and_its_making_things/,10,"I went through some TikTok drafts from 2020, two years ago, when I looked different. I had smaller *everything*. It doesn’t happen very often that I see an older version of myself because I’m so used to clearing up my phone for space reasons and never seeing certain pictures ever again, but this happened because of boredom and I ended up spiraling down the rabbit hole that was my own TikTok drafts. Videos of me being silly and funny, ones nobody ever saw. Then I saw the more recent ones. The difference was obvious. I can totally feel good at the weight I am now, but when I see myself back then it makes me wanna give up on loving myself and just try my hardest to be that small again. 

Any advice?",1644688916.0
"I'll be 19 in 2 months, and am 176cm male, will i still grow more?",7,sqncuk,BodyAcceptance,https://www.reddit.com/r/BodyAcceptance/comments/sqncuk/ill_be_19_in_2_months_and_am_176cm_male_will_i/,4,,1644656574.0
WHERE IS THE INCLUSIVE FASHION?????,24,sprdm3,BodyAcceptance,https://www.reddit.com/r/BodyAcceptance/comments/sprdm3/where_is_the_inclusive_fashion/,15,"so nowadays when fashion brands are photographing models of different sizes that is being called inclusive fashion. And i get that, it's fucking great and breaking stereotypes. But how is that helpful????????? If a curvy woman likes a shirt which is worn by a skinny model, how is she going to know how it would look on her? **INCLUSIVE FASHION SHOULD INCLUDE ALL BODYTYPES IN THE SAME SHIRT.** 

Like how we have in makeup. A lipstick is shown on all different types of skin color. FFS I**NCLUDE ALL TYPES SO THAT WE KNOW WHAT FITS APPROPRIATELY.**",1644556979.0
"Feel Good Friday - February 11, 2022",3,spu208,BodyAcceptance,https://www.reddit.com/r/BodyAcceptance/comments/spu208/feel_good_friday_february_11_2022/,1,"**This is our weekly Feel Good Friday post.**

Tell us about what's made you feel good this week. What's put a smile on your face? What's boosted your confidence?  

*As always, comments must follow the rules of this sub. Comments that break the rules will be removed.*",1644566415.0
3/3 of my body positive gals ! thanks to this sub for all the support 🖤,100,sp3eyc,BodyAcceptance,https://i.redd.it/t9l13bfpezg81.jpg,3,,1644488370.0
"Bi-weekly Body Dissatisfaction Post - February 10, 2022",2,sp18wo,BodyAcceptance,https://www.reddit.com/r/BodyAcceptance/comments/sp18wo/biweekly_body_dissatisfaction_post_february_10/,0,"**Welcome to the r/BodyAcceptance Bi-weekly Body Dissatisfaction Post** for talking about your negative feelings about your body.  This post will be created on Mondays and Thursdays.

As this is a support sub, people may offer advice. If you would prefer to rant without getting advice, please start your comment with [RANT ONLY]. Others are asked to respect that the commenter does not want advice.

**Important: [Please read if you're feeling suicidal or that you may harm yourself](https://www.reddit.com/r/BodyAcceptance/wiki/about-suicide-talk).** 

[Why does this post exist?](https://www.reddit.com/r/BodyAcceptance/wiki/daily-dissatisfaction)

**All comments must follow [the rules of this sub](https://www.reddit.com/r/BodyAcceptance/wiki/rules).**",1644480014.0
"Weekly Recommend/Request Media Post - February 09, 2022",6,so9bnj,BodyAcceptance,https://www.reddit.com/r/BodyAcceptance/comments/so9bnj/weekly_recommendrequest_media_post_february_09/,0,"Want to find social media accounts that are supportive? Have a suggestion for other types of media related to body acceptance?  Post them here.

You can look on our wiki [here for social media accounts](https://www.reddit.com/r/BodyAcceptance/wiki/socialmedia) and [here for other media suggestions](https://www.reddit.com/r/BodyAcceptance/wiki/gallerylinks).  Any suggestions made on these posts will be added to the lists.",1644398116.0
Trying to love my athletic body type,33,snf0fs,BodyAcceptance,https://www.reddit.com/r/BodyAcceptance/comments/snf0fs/trying_to_love_my_athletic_body_type/,9,"Some of my favorite hobbies are athletic (skiing and swimming) and involve training frequently to be in good physical shape. My blessing is that I have a naturally athletic body type and build muscle quite easily. However, when I start to build muscle, there is something in me that wishes for a more slender and elegant looking body. I admire athletic women and find them beautiful and strong, but what I see in myself is different. I want to be in my best physical shape to perform my sports, but this mentality is a roadblock. Do any other athletic girls relate to this?",1644307806.0
