title,score,id,subreddit,url,num_comments,body,created
having a hard time clothes shopping,30,mth99k,BodyAcceptance,https://www.reddit.com/r/BodyAcceptance/comments/mth99k/having_a_hard_time_clothes_shopping/,9,"for the fellow uk members, as you know clothing retail opened again last week. i’ve just started a new job with a smart dress code and i barely had anything to wear (never worked in an office before until now). so yesterday i go to primark to get some clothes for work and i was pretty happy with what i got (2 skirts, 2 pairs of trousers, 2 shirts and a dress) but when i got home, only one skirt fit me. i’m not too fussed as i forgot i always have to go a size up in primark (i’m a size 16). so i go back today to exchange everything for a size 18 and the dress, one pair of trousers and shirts still don’t fit!!!! 

even the things that do fit are still somewhat ill fitting!!!! it’s driving me mad!! on top of the fact that you can’t try things on at the moment, i’m driving back and forth!! i know that primark clothes are not exactly the best quality so i know the sizes are hit and miss but honestly in general, it is so rare to find well fitting clothes as a woman. dressing for a woman’s body is so difficult. my boyfriend fits into literally everything he buys it’s ridiculous. 

just a little rant about clothes✌️",1618766937.0
It's taken a lot of baby steps in body acceptance but I finally was able to make my own Mii that I honestly feels looks like me! I think I look pretty nice ;w;,17,mt1fzg,BodyAcceptance,https://i.redd.it/yc4nyugbhtt61.jpg,5,,1618701570.0
"Inspiration Sunday - April 18, 2021",2,mt7yos,BodyAcceptance,https://www.reddit.com/r/BodyAcceptance/comments/mt7yos/inspiration_sunday_april_18_2021/,0,"**What has inspired you recently?**

Is it a person, some art, some social media, a tv show, or something else?  Share it with us!

**You are welcome to post images, but note that they will automatically be held for moderator review and will be handled as quickly as possible.**

*As always, comments must follow the rules of this sub, including the rule of no selfies or body pictures.  Comments that break the rules will be removed.*",1618729215.0
"Feel Good Friday - April 16, 2021",3,mrxsue,BodyAcceptance,https://www.reddit.com/r/BodyAcceptance/comments/mrxsue/feel_good_friday_april_16_2021/,0,"**This is our weekly Feel Good Friday post.**

Tell us about what's made you feel good this week. What's put a smile on your face? What's boosted your confidence?  

*As always, comments must follow the rules of this sub. Comments that break the rules will be removed.*",1618556413.0
"Bi-weekly Body Dissatisfaction Post - April 15, 2021",6,mr9foz,BodyAcceptance,https://www.reddit.com/r/BodyAcceptance/comments/mr9foz/biweekly_body_dissatisfaction_post_april_15_2021/,21,"**Welcome to the r/BodyAcceptance Bi-weekly Body Dissatisfaction Post** for talking about your negative feelings about your body.  This post will be created on Mondays and Thursdays.

As this is a support sub, people may offer advice. If you would prefer to rant without getting advice, please start your comment with [RANT ONLY]. Others are asked to respect that the commenter does not want advice.

**Important: [Please read if you're feeling suicidal or that you may harm yourself](https://www.reddit.com/r/BodyAcceptance/wiki/about-suicide-talk).** 

[Why does this post exist?](https://www.reddit.com/r/BodyAcceptance/wiki/daily-dissatisfaction)

**All comments must follow [the rules of this sub](https://www.reddit.com/r/BodyAcceptance/wiki/rules).**",1618470012.0
"Weekly Recommend/Request Media Post - April 14, 2021",10,mqm4ix,BodyAcceptance,https://www.reddit.com/r/BodyAcceptance/comments/mqm4ix/weekly_recommendrequest_media_post_april_14_2021/,0,"Want to find social media accounts that are supportive? Have a suggestion for other types of media related to body acceptance?  Post them here.

You can look on our wiki [here for social media accounts](https://www.reddit.com/r/BodyAcceptance/wiki/socialmedia) and [here for other media suggestions](https://www.reddit.com/r/BodyAcceptance/wiki/gallerylinks).  Any suggestions made on these posts will be added to the lists.",1618388111.0
How do you deal with negative comments about your body?,41,mq0oon,BodyAcceptance,https://www.reddit.com/r/BodyAcceptance/comments/mq0oon/how_do_you_deal_with_negative_comments_about_your/,22,"I’m trying my best to stay healthy and accept myself, but my family keeps taking jabs at my weight and eating habits. I have tried to defend myself but they don’t stop. 

Any advice on how to not take these comments to heart? I grew up with an eating disorder, which makes it hard to not listen to them when they say these things. I just need to not let it get to me so I can keep up with my new healthy lifestyle.",1618314861.0
"Grateful & GratiTuesday - April 13, 2021",1,mpx0r1,BodyAcceptance,https://www.reddit.com/r/BodyAcceptance/comments/mpx0r1/grateful_gratituesday_april_13_2021/,0,"**Welcome to our weekly Grateful & GratiTuesday post.**

What are you grateful for?

What about your body brings you gratitude and joy?

What in your life helps you achieve body acceptance?

Share your thoughts!  

*(As always, all comments must follow [the rules of this sub](https://www.reddit.com/r/BodyAcceptance/wiki/rules). Comments that break the rules will be removed.)*",1618297216.0
"Bi-Weekly Body Dissatisfaction Post - April 12, 2021",10,mp8l6g,BodyAcceptance,https://www.reddit.com/r/BodyAcceptance/comments/mp8l6g/biweekly_body_dissatisfaction_post_april_12_2021/,4,"**Welcome to the r/BodyAcceptance Bi-weekly Body Dissatisfaction Post** for talking about your negative feelings about your body.  This post will be created on Mondays and Thursdays.

As this is a support sub, people may offer advice. If you would prefer to rant without getting advice, please start your comment with [RANT ONLY]. Others are asked to respect that the commenter does not want advice.

**Important: [Please read if you're feeling suicidal or that you may harm yourself](https://www.reddit.com/r/BodyAcceptance/wiki/about-suicide-talk).** 

[Why does this post exist?](https://www.reddit.com/r/BodyAcceptance/wiki/daily-dissatisfaction)

**All comments must follow [the rules of this sub](https://www.reddit.com/r/BodyAcceptance/wiki/rules).**",1618210815.0
"Both my sister and I hate our side profiles (mainly our recessed chins, and my nose) but as I drew them I felt like I could start viewing them as artistic",206,momgjk,BodyAcceptance,https://i.redd.it/p7y82q62xhs61.png,9,,1618125735.0
Stretch marks,7,moggni,BodyAcceptance,https://www.reddit.com/r/BodyAcceptance/comments/moggni/stretch_marks/,6,Is it normal for new stretch marks to itch and feel sore?,1618100545.0
A painting I did I thought y'all might appreciate. 💙✨,303,mnwh1f,BodyAcceptance,https://i.redd.it/rgbzedrme9s61.jpg,5,,1618022691.0
"Inspiration Sunday - April 11, 2021",1,mom73d,BodyAcceptance,https://www.reddit.com/r/BodyAcceptance/comments/mom73d/inspiration_sunday_april_11_2021/,1,"**What has inspired you recently?**

Is it a person, some art, some social media, a tv show, or something else?  Share it with us!

**You are welcome to post images, but note that they will automatically be held for moderator review and will be handled as quickly as possible.**

*As always, comments must follow the rules of this sub, including the rule of no selfies or body pictures.  Comments that break the rules will be removed.*",1618124414.0
Plus size goddess (art by me),38,mntw7y,BodyAcceptance,https://i.redd.it/y9tuhixql8s61.jpg,8,,1618012967.0
"Feel Good Friday - April 09, 2021",6,mnbmws,BodyAcceptance,https://www.reddit.com/r/BodyAcceptance/comments/mnbmws/feel_good_friday_april_09_2021/,2,"**This is our weekly Feel Good Friday post.**

Tell us about what's made you feel good this week. What's put a smile on your face? What's boosted your confidence?  

*As always, comments must follow the rules of this sub. Comments that break the rules will be removed.*",1617951611.0
Looking for instagram women that look like me?!,0,mn2e7z,BodyAcceptance,https://www.reddit.com/r/BodyAcceptance/comments/mn2e7z/looking_for_instagram_women_that_look_like_me/,0,"I’m south asian (indian & srilankan), size 10/12, waist and hips and basically the same size, have a tummy and big legs & boobs. there’s literally no one who i can find that’s even remotely similar to me as there just aren’t many south asian ‘influencers’ :(",1617918477.0
"Bi-weekly Body Dissatisfaction Post - April 08, 2021",2,mmm43l,BodyAcceptance,https://www.reddit.com/r/BodyAcceptance/comments/mmm43l/biweekly_body_dissatisfaction_post_april_08_2021/,2,"**Welcome to the r/BodyAcceptance Bi-weekly Body Dissatisfaction Post** for talking about your negative feelings about your body.  This post will be created on Mondays and Thursdays.

As this is a support sub, people may offer advice. If you would prefer to rant without getting advice, please start your comment with [RANT ONLY]. Others are asked to respect that the commenter does not want advice.

**Important: [Please read if you're feeling suicidal or that you may harm yourself](https://www.reddit.com/r/BodyAcceptance/wiki/about-suicide-talk).** 

[Why does this post exist?](https://www.reddit.com/r/BodyAcceptance/wiki/daily-dissatisfaction)

**All comments must follow [the rules of this sub](https://www.reddit.com/r/BodyAcceptance/wiki/rules).**",1617865211.0
And she’s not even skinny!,152,mlpb0a,BodyAcceptance,https://www.reddit.com/r/BodyAcceptance/comments/mlpb0a/and_shes_not_even_skinny/,19,"I am incensed. I’m a nurse and the other day I took on a patient who developed persistent encephalopathy related to a vitamin B deficiency. What caused the vitamin B deficiency? Gastric bypass surgery. 
She broke her brain trying to get thin. 

What did the offgoing nurse have to say about it? “It’s so sad, she didn’t even lose the weight.” 

I’m so tired of medical personnel prioritizing skinny over healthy.",1617753177.0
"Weekly Recommend/Request Media Post - April 07, 2021",2,mlxekj,BodyAcceptance,https://www.reddit.com/r/BodyAcceptance/comments/mlxekj/weekly_recommendrequest_media_post_april_07_2021/,0,"Want to find social media accounts that are supportive? Have a suggestion for other types of media related to body acceptance?  Post them here.

You can look on our wiki [here for social media accounts](https://www.reddit.com/r/BodyAcceptance/wiki/socialmedia) and [here for other media suggestions](https://www.reddit.com/r/BodyAcceptance/wiki/gallerylinks).  Any suggestions made on these posts will be added to the lists.",1617783313.0
Feel like I have to have a bad ED before I can start recovery/accept myself,36,ml99cd,BodyAcceptance,https://www.reddit.com/r/BodyAcceptance/comments/ml99cd/feel_like_i_have_to_have_a_bad_ed_before_i_can/,16,"i’m so aware of how ignorant and rude this sounds. but every one who posts on places like youtube etc talking about body confidence almost always started off with a full blown ED, lost a bunch of weight and their recovery was gaining muscle and ofc mentally accepting them self. 
I don’t have an ED, i defo have disordered eating though. But i feel like i can’t accept myself/work towards accepting myself until i’m literally underweight, i’m not underweight currently and i’m not that close to being underweight either. but most ppl who talk about bodi posi do still have the idea body type (ofc they’re still allowed to have insecurities im not denying that) so i feel like i can’t accept myself at my current weight bc i still have fat etc",1617707733.0
"Grateful & GratiTuesday - April 06, 2021",3,ml5rq2,BodyAcceptance,https://www.reddit.com/r/BodyAcceptance/comments/ml5rq2/grateful_gratituesday_april_06_2021/,3,"**Welcome to our weekly Grateful & GratiTuesday post.**

What are you grateful for?

What about your body brings you gratitude and joy?

What in your life helps you achieve body acceptance?

Share your thoughts!  

*(As always, all comments must follow [the rules of this sub](https://www.reddit.com/r/BodyAcceptance/wiki/rules). Comments that break the rules will be removed.)*",1617692415.0
"I'm working on a new body confidence project, starting with a series of self portraits in my ""I feel amazing in this"" underwear.",157,mk3upv,BodyAcceptance,https://i.redd.it/j4ahf4f0s7r61.jpg,7,,1617567126.0
Tall girl tired of being told I’m tall,18,mkcr5t,BodyAcceptance,https://www.reddit.com/r/BodyAcceptance/comments/mkcr5t/tall_girl_tired_of_being_told_im_tall/,13,"I’m (24F) 5’ 10” - I’m no professional athlete, but obviously I’m on the taller side and I have more of an athletic build. I’m not model skinny. I’ve got thicker thighs, a big butt, and broad shoulders. Since high school, I thought I was, in general, fairly confident about being a tall woman. I used to love the way it made me feel powerful and gave me a high vantage point in crowds. I don’t (anymore) feel threatened by the crowd of men who are obsessed with short girls. I thought I had become so resiliently secure about my height, that I’m surprised to find recently I’ve been so annoyed and at times almost hurt by frequent comments about my height. 

I think the recent comments have stemmed from the fact that I’ve met some people over Zoom in the last year (like coworkers and some people in a church community group), and upon meeting them in person for the first time, their initial (not ill-intentioned) comment is something along the lines of “WOW I had no idea you were so tall!” It’s just awkward for one thing, like how am I supposed to respond to that? “Yep, I’m a tall girl!”?? I don’t typically comment on someone’s appearance unless I’m complimenting their outfit, so it’s just a strange phenomenon to me that people feel comfortable saying such a thing. Like honestly, what response do they expect? I even had a coworker (very petite female) say “I don’t even understand how you find pants that fit.” I just wanted to say “Well, I’ve been shopping for pants for my body for the last 10 years so I’m pretty good at it,” but I always just end up laughing these things off or playing along like “oh girl it’s a struggle!” because I don’t want to be rude. It’s gotten to the point where when I see people for the first time who’ve previously only known me on the phone, I just KNOW they are sizing me up and overcome by an impression about my height. 

I think this has started to mess with my security and body-image, because apparently my height and stature is such a noticeable thing that people immediately feel the need to draw attention to it. For the most part it is rightly socially unacceptable to comment on someone’s weight in western cultures, so why is it fair game to bring up someone’s height? Aside from my coworkers and church people, my roommates have frequently commented on my height, as well as my friends, every guy I’ve ever been on a date with, random people in the grocery store, etc etc. Does anyone else relate, and how should I respond in these situations?? And how can I get over the way these interactions make me feel about myself? Maybe I’m overly sensitive?!",1617597513.0
"Bi-Weekly Body Dissatisfaction Post - April 05, 2021",1,mkeptj,BodyAcceptance,https://www.reddit.com/r/BodyAcceptance/comments/mkeptj/biweekly_body_dissatisfaction_post_april_05_2021/,7,"**Welcome to the r/BodyAcceptance Bi-weekly Body Dissatisfaction Post** for talking about your negative feelings about your body.  This post will be created on Mondays and Thursdays.

As this is a support sub, people may offer advice. If you would prefer to rant without getting advice, please start your comment with [RANT ONLY]. Others are asked to respect that the commenter does not want advice.

**Important: [Please read if you're feeling suicidal or that you may harm yourself](https://www.reddit.com/r/BodyAcceptance/wiki/about-suicide-talk).** 

[Why does this post exist?](https://www.reddit.com/r/BodyAcceptance/wiki/daily-dissatisfaction)

**All comments must follow [the rules of this sub](https://www.reddit.com/r/BodyAcceptance/wiki/rules).**",1617606021.0
Confused??,23,mjkkc3,BodyAcceptance,https://www.reddit.com/r/BodyAcceptance/comments/mjkkc3/confused/,11,"Hi! I’ve never posted on Reddit before I mainly go on here to browse around random scary story stuff but I’ve been struggling a bit with something that’s been a bit confusing. I’m 16, turning 17 soon (I didn’t see any rules about age but if it missed it my apologies) and I struggle a lot with my body image when I’m around my mother, she likes to point things out to my face but recently she keeps bombarding me with comments telling me I have a ‘flat ass’ or ‘no ass’ and then makes fun of me for it! Types of comments like these are common with her I remember once in the 6th grade she told me my little sister was going to have bigger boobs then me (I’m not really sure why that matters when you’re in the 6th grade). This isn’t an isolated situation either, she has been commenting on my body since middle school and likes to tease me and use words referring to my body that she knows I don’t like, normal bodily functions like periods are a huge embarrassment due to how she has treated me in the past regarding them and now I can’t ask for help about it and can barely even tell my dad (I live with him) or talk to her when I need any of those products! Things like that are a huge embarrassment to me now and I hate it

I just wanted to reach out and express my confusion and frustrations to see if anyone had any advice how to handle this or had gone through something similar, once again this is my first time posting anything on Reddit and I’m just extremely frustrated with how my mother treats my body compared to my sisters. Thank you to anyone who may read this or comment on this I’m just at my wits end",1617494457.0
"Inspiration Sunday - April 04, 2021",2,mjr6dx,BodyAcceptance,https://www.reddit.com/r/BodyAcceptance/comments/mjr6dx/inspiration_sunday_april_04_2021/,0,"**What has inspired you recently?**

Is it a person, some art, some social media, a tv show, or something else?  Share it with us!

**You are welcome to post images, but note that they will automatically be held for moderator review and will be handled as quickly as possible.**

*As always, comments must follow the rules of this sub, including the rule of no selfies or body pictures.  Comments that break the rules will be removed.*",1617519615.0
Some stickers I made recently. 💙,134,mj12as,BodyAcceptance,https://i.redd.it/rsiolglgvvq61.jpg,10,,1617422997.0
Body Acceptance Songs? Melon Cake- Demi Lovato,7,mj2r07,BodyAcceptance,https://www.reddit.com/r/BodyAcceptance/comments/mj2r07/body_acceptance_songs_melon_cake_demi_lovato/,2,"Not sure if any of you like pop music, but Demi had a new album come out lastnight in which she sings candidly about her struggles with mental health, drug addiction, and body image. This song “melon cake”[Melon Cake](https://youtu.be/jq9719LKw0w) is a certified bop in my book. It’s a huge FU to dieting and restricting and learning to love yourself again at every stage. I was curious what other body acceptance songs you all listen to?


A little background on the song if anyone is interested: In 2018, Demi posted a photo of her birthday cake, which was a watermelon covered in fat free whip frosting. In this song she blatantly says:
“And now I'm sayin' no more melon cakеs on birthdays. No more barricades in doorways. Finally get to do things my way” She also has another line: “Dear little me, I'm sorry that it took so long. But baby, you're free”
I love this line because it reminds me of how badly I wanted to love myself as a child, and now that I finally do I want to give her a huge hug. Anyways, have a listen if you enjoy catchy pop music!",1617430196.0
Since you all loved the last art work I shared I figured I’d share some more 😊,88,mikt6g,BodyAcceptance,https://i.redd.it/0c82bhefmrq61.jpg,10,,1617371530.0
Hi guys! I am a female digital artist and I do mostly body positive work! Just wanted to share a of my piece with you all 😊,122,mhwkx2,BodyAcceptance,https://i.redd.it/b7z94ecookq61.jpg,28,,1617287546.0
"Feel Good Friday - April 02, 2021",4,miey4n,BodyAcceptance,https://www.reddit.com/r/BodyAcceptance/comments/miey4n/feel_good_friday_april_02_2021/,1,"**This is our weekly Feel Good Friday post.**

Tell us about what's made you feel good this week. What's put a smile on your face? What's boosted your confidence?  

*As always, comments must follow the rules of this sub. Comments that break the rules will be removed.*",1617346813.0
Dear teen trying to get that perfect body:,34,mhwup7,BodyAcceptance,https://www.reddit.com/r/BodyAcceptance/comments/mhwup7/dear_teen_trying_to_get_that_perfect_body/,4,"Have you tried counting calories? The keto diet? How about working out more? Have you tried skipping breakfast, that is always a winner. Look at how skinny your friend got this spring, don’t you wish that was you? What are we doing? All of this is pointless, so just put on a big sweatshirt and call it good.

So much of my time used to be spent counting calories and working out until I physically couldn’t anymore. There were times I would even work out on an empty stomach, resulting in sharp pains that took me to the floor, where I would lay for minutes at a time trying to grasp onto consciousness. My muscles were almost always in pain, my stomach was almost always empty.

I was conditioned to think that it would help me get the body I needed…wanted, as I was a little more “heavy-set” back then. My grandmother had pounded words into my head that ultimately led to eating disorder after eating disorder. I am *still* in recovery. My mom *still* has to scribble out the nutritional facts on food so that I’ll eat it without such a large amount of guilt that my chest gets tight. My grandma *still* makes comments. It is one of the hardest processes I have ever been through. And for what? Society’s image of a perfect body?

**No thanks.**

Like you, I so wish that I didn’t care. I so wish that my grandmother—and yours-- didn’t ask:

“Are you really going to eat all that?”

“Didn’t you already have some of that earlier?”

“Weight Watchers said…”

Maybe I shouldn’t have eaten it. Maybe I should have followed grandmother’s flawed system of calorie counting.

**Maybe I should have listened.**

The thing is, though, nothing ever changed. Had I listened or not, It is all a mental game.

So there you are, looking at yourself in the mirror, hating what you see. I’ve been there. It sucks.

While you were focusing on how imperfect you are, your body kept you alive.

Do you ever think about how crazy that is? All that your body can do? Your body has grown with you, been broken and rebuilt itself, carried you as far as you desire to go. It is a machine, and it is your own. 

So, why are you so worried about how it looks?

You are your worst critic, and there is absolutely no reason for you to be. Every detail, whether it be considered a flaw or not, is unique to you. The way the corners of your eyes crease when you smile, the snort that slips out when you are caught up in laughter, the freckles cover you from head to toe, even the scars you have from the scooter accidents as a child. It is not all about your size, because I can put money on the fact that people never worry about your weight when the room is being lit up by that gorgeous smile of yours. You are built exactly how you are supposed to be, in all of your glory. 

If Jessica from third period doesn’t like the way you look, that is her problem.

If that boy you have a crush on thinks you aren’t an absolute goddess, he for sure wouldn’t be good enough to chase after anyway.

Start living your life for yourself. Do what makes you happy.

Eat what you want. Don’t count those calories. Don’t restrict yourself from your favorite foods. Work out as much as you are comfortable with or not at all.

And above all else, NEVER skip breakfast.

You and all the beautiful uniqueness of your being are worthy of all the love in the world. 

Dear teen trying to get that perfect body:

Stop. **You already have it.**",1617288347.0
"Bi-weekly Body Dissatisfaction Post - April 01, 2021",4,mhpp7s,BodyAcceptance,https://www.reddit.com/r/BodyAcceptance/comments/mhpp7s/biweekly_body_dissatisfaction_post_april_01_2021/,2,"**Welcome to the r/BodyAcceptance Bi-weekly Body Dissatisfaction Post** for talking about your negative feelings about your body.  This post will be created on Mondays and Thursdays.

As this is a support sub, people may offer advice. If you would prefer to rant without getting advice, please start your comment with [RANT ONLY]. Others are asked to respect that the commenter does not want advice.

**Important: [Please read if you're feeling suicidal or that you may harm yourself](https://www.reddit.com/r/BodyAcceptance/wiki/about-suicide-talk).** 

[Why does this post exist?](https://www.reddit.com/r/BodyAcceptance/wiki/daily-dissatisfaction)

**All comments must follow [the rules of this sub](https://www.reddit.com/r/BodyAcceptance/wiki/rules).**",1617260413.0
