title,score,id,subreddit,url,num_comments,body,created
"Just discovered this community, let's keep in touch.",11,svzm4u,Orthorexia,https://www.reddit.com/r/Orthorexia/comments/svzm4u/just_discovered_this_community_lets_keep_in_touch/,1,"Hi everyone,

After going to therapy for more than a year, I've been slowly coming to terms that I have orthorexia. I'm anxious about eating out, I weigh out every food I eat, and if I miss working out, I go into a depressive episode. Physically, I'm in very good shape, but mentally, I'm exhausted having to think about everything I allow myself to eat. And as you know, mental health is the foundation for all things health.

I just wanted to say that you're not alone and solving any problem starts with recognizing that there is one. Now that I've discovered this subreddit, I would love to stay engaged with all of you.

Have a great weekend! Don't be me and let yourself eat good food. I'll be eating my unsalted spinach & turkey breast...",1645239087.0
Has anyone been able to strike a balance?,3,st6l80,Orthorexia,https://www.reddit.com/r/Orthorexia/comments/st6l80/has_anyone_been_able_to_strike_a_balance/,2,"Or at least know of any good resources that might help? I’m in therapy but my insurance is almost out so I’m looking for some self help stuff. I have a very much all or nothing approach to eating, if I’m in my “junk” mindset I literally eat whatever I want whenever I want, mostly sugary and greasy processed foods, fast food every day (sometimes 2-3 times a day), going weeks without touching a fruit or vegetable. Then when I go into “healthy” mode I obsess about nutrients, pesticides, free radicals, saturated fat, etc. Refuse to have any treats and a normal meal (like spaghetti and meatballs or homemade pizza) feels like eating poison. I need to find a happy medium so I can be happy and healthy but I just can’t seem to do it",1644941829.0
going down the orthorexic rabbit hole,6,sj6rmk,Orthorexia,https://www.reddit.com/r/Orthorexia/comments/sj6rmk/going_down_the_orthorexic_rabbit_hole/,5,"recently i feel like i've started to develop genuine orthorexia. i've never had disordered eating and i honestly quite want to put weight on.

since these past few months i have gone further down the rabbit hole bc i have been sick. i started being sick in 2018 and it's not gotten better (infections, liver/gall bladder pain, bloating, horrible pain and pressure in my lower left abdomen). i realized i was reacting to gluten (especially fried gluten) and i cut it out. i do feel a little bit better but not much.

and now i've gain this obsession with eating 'right' to control my symptoms. i've found out about oxalates, then phytic acid, then lectins. and now, as of this week, apparently all nightshades, all cruciferous veggies, most fruits are also out of the list as per articles like ones from doctor kiltz (i won't post here bc i do not want to trigger anyone). but it's become so bad that i am afraid of most food that isn't meat, hard cheese, bananas and pineapple. i hear so many proponents of carnivore eating and it makes so much sense to me but it strikes me as impossible. i've been used to have a veggie/starch side with my mains all my life.

it sucks enough that i can't have homemade chicken noodle soup or ramen bc they have gluten i don't wanna cut out all veggies. some ppl say you should never have tomatoes but i love them :(. and don't get me started about sugar - i have been a lifelong hardcore addict - i ONLY drank coca cola, never water, i ate one dessert a day, i used to start my day off with croissants. now i've reduced it to one soda day and replaced all the sugar with fruit- but now i binge on fruit - i have bananas, pineapple, red and green grapes every day. i feel like a maniac i'm craving and eating a whole damn bowl of grapes a day and now i've found out they're bad bc oxalates phenols tannins. gaaaah i'm going crazy. i'm at the point where i need to know which is the safer option of a side dish between mash potatoes and white rice.

i use to be indifferent or proud of eating veggies and healthy meat. now - today for ex - i had wild norwegian salmon with boiled broccoli and it was delicious - but then i immediately started to regret bc apparently cruciferous veggies damage the mitochondria and our digestive enzymes.

 i don't know what to do - i clearly react to gluten and added sugar - but i don't want to become a carnivore - as much as i love meat - i love veggies too. idk has anyone ever debunked this, is this all just bs, or people peddling their own interests? phytates seem to be legit. sorry for the long post i just need a strategy or advice or just to vent before i go devour a bag of oxalate-phytate-lectin laden potato chips :(.",1643853574.0
"Anorexic years ago, now extreme orthorexic due to auto immune disease and PCOS",8,sa5m5r,Orthorexia,https://www.reddit.com/r/Orthorexia/comments/sa5m5r/anorexic_years_ago_now_extreme_orthorexic_due_to/,8,"Lately I’ve been getting these realizations of like, well maybe this is just the way my life is going to be forever. I have hypothyroidism, hashimotos and PCOS. All three of these diseases have triggered me to become extremely and full blown orthorexic. My body reacts when I eat a variety of fruits and vegetables. I have a laundry list of foods I cannot have after having a food sensitivities test. Yesterday I spent the majority of the day feeling like shit because my body flared up from eating a nightshade. (Zuchinni).  I just don’t even feel like “recovery” is remotely possible for me. I’m eating a list of maybe 10 “safe” foods, and maintaining my weight from eating very little and the cleanest one can possibly eat to keep away from the body flaring up.  Orthorexia due to auto immune disease just seems like a different monster than anorexia. I was anorexic 2004-2006. I did treatment, I ate whatever food they told me to eat, and that was that, but now this is not as black and white. The way I’m eating is extreme and it’s due to physical health issues. I just need some kind and supportive messages/comments right now. (Yes I have a therapist and dietian :) ) they aren’t really helping me get through this.",1642867457.0
"SO has orthorexia, I've lost all desire to have food with them",5,s7h6r9,Orthorexia,https://www.reddit.com/r/Orthorexia/comments/s7h6r9/so_has_orthorexia_ive_lost_all_desire_to_have/,8,"Hi, I could use advice. My long term SO has orthorexia (although they deny it- they are just healthy....).

I used to love cooking and eating as a couple/family. But no more. This has been a few years now.  I feel nothing for food because it has become so contentious... does anyone who is a SO of someone have any ideas on how to regain my own old interest in food. Right now cooking just makes me sad because they won't eat with me, and just get their special food.  We used to share flavours and new dishes and experiences.  I feel lonely and sad with food now.

Thanks",1642565626.0
I'm scared of developing orthorexia,3,rxezhp,Orthorexia,https://www.reddit.com/r/Orthorexia/comments/rxezhp/im_scared_of_developing_orthorexia/,4," I'm scared of developing orthorexia, as that I don't want to make the healthy part of my life be unhealthy, I haven't done anything extreme to be clear like I'm just trying to stay away from sugars fried food, and processed food, and eating more protein, like I just want some opinions about this so I don't take it to far and hurt myself",1641476871.0
Can I still lose weight in recovery,9,ru4e2v,Orthorexia,https://www.reddit.com/r/Orthorexia/comments/ru4e2v/can_i_still_lose_weight_in_recovery/,1,"For the past several years I have been obsessed with cutting carbs and sugars out of my diet while adding as many healthy fats and vegetables as I could. Anything sweet was off the table. Anything processed was off the table. I would do 24h water fasts twice a week. I would go through 'bad' food binging periods which I would cry over while poking at my body. 

Food torments me so much that I need to recover. I am also 5 lbs over weight and desperately want to lose 15lbs to be at a better weight. This extra weight torments me even more than my food choices do. Is there a way to recover and stop viewing food as 'good' or 'bad' while still losing weight.

I'm only 20 and I really don't know where to start.",1641107981.0
Red food colouring…,8,rkqk2s,Orthorexia,https://www.reddit.com/r/Orthorexia/comments/rkqk2s/red_food_colouring/,2,So I just made baked oats (sugar cookie flavour!) And I love baked oats I make them almost every morning sweetened with banana and sometimes monk fruit sugar too. So all natural stuff. But this morning to make it Christmassy I tried adding red food colouring. And I added A LOT. But then I started looking at the ingredients on the food colouring and it’s all weird chemicals and now my brain is telling me if I eat these oats I’ll die or something. I don’t know. I’m just spiraling and I feel awful about eating these oats now because they feel unhealthy and full of chemicals. Can someone please reassure me or something idk,1640016208.0
Just need to vent.,12,rio5do,Orthorexia,https://www.reddit.com/r/Orthorexia/comments/rio5do/just_need_to_vent/,8,"Earlier this year I took a nutrition class for uni. Studying nutrition made me realize how shitty my diet was and how it could potentially harm my future health. 

Starting in September I cut out processed foods, dairy, red meat, and most carbs. I became obsessed with the idea of eating “clean” and “whole” foods. 
Truthfully weight loss was not at the forefront of my mind when making these dietary changes. I just really wanted to be healthy and feel good which I did at first. 

From then to now I’ve dropped a significant amount of weight and experience loads of side effects daily. I’m constantly dizzy, my hair is falling out by the handfuls, I can hear my pulse in my ear, I’ve even passed out for the first time ever. 

I recently had a physical with my Dr. and he was concerned with my recent symptoms and overall food intake. He said I eat really clean but encouraged me to be balanced. He ordered an EKG and it came back abnormal… 

Im currently wearing a heart monitor for a couple of weeks and I've never felt so helpless. I feel like it’s my fault. 

I know that my relationship with food is not normal. My mom thinks I’ve developed an ED and wants me to get help If I continue to loose weight. Is it weird that I feel like I don’t have an ED? I don’t count calories or weigh myself. I eat, I exercise, I take vitamins/supplements, I sleep plenty.

I feel guilty complaining because I know people have it so much worse than me.",1639767182.0
"Hello friends, might be one of you",12,r8hdtb,Orthorexia,https://www.reddit.com/r/Orthorexia/comments/r8hdtb/hello_friends_might_be_one_of_you/,1,"I’m so happy I found this sub. I’ve been diagnosed with OCD not orthorexia but I really have many symptoms of it. I definitely restrict food as a sense of control and have had many food compulsions. I’ve had GI issues for years and have done every diet for it, it looks like reducing gluten and some fodmaps are ideal for me. I was later diagnosed with endometriosis and had surgery which has helped a lot. I’ve also had thyroid issues causing my weight to fluctuate a ton. 

I get very stressed out worrying that I’m not eating healthy enough and that it’s my own fault for having medical problems. I always feel if I could just be healthier, eat cleaner, lose more weight my health will be better, if not it’s my own fault I’m sick. My recent pcp and coyote expressed that I should be losing weight still, I’m 5’4 150 so overweight. I got into strength training and work out regularly. 

I don’t eat fast food, drink soda, I don’t like going to restaurants or getting take out. I’m always trying to reduced processed foods, cold cuts, dairy, gluten plus fodmap triggers (onions, raisins, apples, etc). I don’t eat fish/seafood, eggs, peanuts/peanut butter, most spices (Asian food, curry etc). I never realized how restrictive I am until I wrote it out like this. 

I feel like I start everyday trying to just eat right and I always cave or do something wrong, it’s just never enough. I’m constantly guilty and feel shame. I’ve been trying to lose weight for a while and that’s been a big trigger too, I think if I cut out enough foods I’ll finally lose some weight.",1638591677.0
What do you eat in a day?,10,r8142w,Orthorexia,https://www.reddit.com/r/Orthorexia/comments/r8142w/what_do_you_eat_in_a_day/,1,I’m really struggling to find safe foods. Looking for motivation of what a full day of eating could look like. Thanks so much,1638543988.0
HELP US WITH MAKING OUR DOCUMENTARY ABOUT ORTHOREXIA!,8,r76wu6,Orthorexia,https://www.reddit.com/r/Orthorexia/comments/r76wu6/help_us_with_making_our_documentary_about/,3,"&#x200B;

https://reddit.com/link/r76wu6/video/yogfarf5n4381/player

Hello everyone,

A friend and I have been making a short documentary about orthorexia. We really really want to pay attention to the topic and finish this documentary, but unfortunately we don’t receive any financial support. That's why we have set- up a crowdfunding! You can help us by donating via the link below. There are nice thank yous and gifts linked to the donations and every little bit helps!

We are from the Netherlands, but the video has subtitles, so you can see what it's all about.

You can donate via this link: [https://www.voordekunst.nl/projecten/13016-ziek-gezond-1](https://www.voordekunst.nl/projecten/13016-ziek-gezond-1)

Sharing is also greatly appreciated!

Thank you in advance! ❤",1638449894.0
vent,14,qz0sq1,Orthorexia,https://www.reddit.com/r/Orthorexia/comments/qz0sq1/vent/,1,i feel like im failing having an eating disorder. i obsessively eat healthy food but its not enough. when i mess up and give in to temptation i get rid of it. im lactose intolerant so i purposely drink milk so i can poop out the extra food. i fake allergies when i go to restaurants so i can eat “healthily”.  i dont know whats wrong with me. its barely about weight at this point. it only started after my assault. i just want to recover.,1637518448.0
Recovery,7,qygp6r,Orthorexia,https://i.redd.it/lgul1vkzut081.png,2,,1637448058.0
Change to sub publicity.,11,qydbgz,Orthorexia,https://www.reddit.com/r/Orthorexia/comments/qydbgz/change_to_sub_publicity/,3,"Hi everyone; quick update.

I was not aware that the sub required approval for users to post. I have since changed the sub to be public meaning that anyone can post freely without having to wait for Mod approval.

I apologize to anyone who requested approval and did not receive a response; I had not been receiving ModMail notifications at all for several months but this has since been resolved and won't be an issue moving forward. Please feel free to reach out to me if you need anything.

Thanks everyone.",1637437985.0
My electric teal smoothie bowl 500ml,21,o6mq91,Orthorexia,https://i.redd.it/t8qv70w953771.jpg,1,,1624484613.0
orthorexic binges,35,nzicxt,Orthorexia,https://www.reddit.com/r/Orthorexia/comments/nzicxt/orthorexic_binges/,18,"TW: mention of binging and calories. 

hi everyone, im new to the group and suffer with orthorexia. Im raw vegan and on a normal day ill eat around 1,300 cals max. 

I wondered if any one else with orthorexia occasionally binges or if its just me? my 'healthy binge' last night consisted of, two Nakd fruit and nut bars, two rice cakes, an apple, a pear, a bowl of porridge, two carrots and half a cucumber with hummus, half a pack of baby plum tomatoes and half a pack of mushrooms with low cal light soy sauce. I felt super full after, but I didn't feel too guilty, its weird.

can anyone relate?",1623660602.0
So fucking healthy,13,nta66h,Orthorexia,https://i.redd.it/p1gdrirm1d371.jpg,0,,1622941954.0
"Bout to be a lot of tiny puppies named ""raisins"" and ""almonds"" 😂",30,nsp6i2,Orthorexia,https://i.redd.it/iwjim4pd2e371.jpg,10,,1622873424.0
I am obsessed with diet food despite being 97lbs,23,nso17d,Orthorexia,https://www.reddit.com/r/Orthorexia/comments/nso17d/i_am_obsessed_with_diet_food_despite_being_97lbs/,0,,1622868943.0
New mod announcement/sub updates,5,mvo510,Orthorexia,https://www.reddit.com/r/Orthorexia/comments/mvo510/new_mod_announcementsub_updates/,1,"Hello everyone,

I would like to introduce myself to you as a new mod for this subreddit!

I'm very excited and I hope that we can continue to have this sub be a safe and accepting place where we can discuss our thoughts.

To update you all, so far I have:

\-Updated the sub's description

\-Created some basic official rules for the sub (which I have also posted below in a comment)

\-Created post flairs

I want to emphasize that I value your opinions and in an effort to make this sub the best it can be for as many people as possible, I invite you to let me know if there is a particular rule or flair you would like to see added.

Lastly, as you can see, our sub does not have a photo yet. I think it would be fun to come up with it together as a community so I will be making a separate post later this week where we can brainstorm/submit ideas for the sub photo.

Thanks everyone!",1619035451.0
Update: Request for interview,4,mrclu6,Orthorexia,https://www.reddit.com/r/Orthorexia/comments/mrclu6/update_request_for_interview/,3,"Hi everyone, I hope you are doing well. 

I wish I am not being too pushy/annoying, but I wanted to give an update for my previous post about a request for an interview. The interviews I have had so far has been amazing and extremely useful (I am super grateful for the participants!), but unfortunately, I am still searching for my final interviewee.  This research means a lot to me and in order to make great analyses, I would love to get personal experiences from another person. Of course, I would only ask to share information that you are comfortable with sharing. I will be extremely grateful if you could help me and my research out.

Please pm me if you are interested! Have a great day :)",1618485832.0
I thought I was faking an eating disorder,38,mqwoes,Orthorexia,https://www.reddit.com/r/Orthorexia/comments/mqwoes/i_thought_i_was_faking_an_eating_disorder/,9,"Very recently, within the past couple of months, I've been learning about orthorexia after a friend approached me about my eating habits. I've struggled with body image since the age of 11, when my mother lovingly pointed out that my little stomach could be seen under my tank top. I say little because I used to always compare my body TO MY ELEVEN YEAR OLD BODY and think ""well I've always been fat"" despite being a completely healthy weight. My parents always encouraged healthy eating (no fast food, no microwave dinners, no ""junk food""), and used negative words and connotations to reinforce a healthy eating mindset. I've been restricting what I put into my body since I hit double digits, and before that it was just my parents restricting it for me. I don't think my parents ever encouraged eating disorder behavior, but growing up I never had a good relationship with food because of this. I would binge on junk food when I went to my friends' houses since I never got to have it at my own house. Once I got my license, I loved going to drive thru fast food places more for the experience than the actual food. In high school, I would meal prep everything just to control myself; because otherwise I would go HAM in the cafeteria. In 2017 I suffered a TBI that left me without the ability to feel hunger. That on top of a poor relationship with food made me stop eating for a while. I thought this was normal. Freshman year of college I passed out during a final presentation because I forgot to eat for 3 days. At first, my lack of eating wasn't intentional, I just had no desire to put calories in my body if I couldn't even feel hunger. There was no satisfaction, just guilt. In college, I became obsessed with my health. I turned to supplements to ensure I was getting the most out of my body. I would skip class to go work out, and my body looked amazing so that reinforced the bad behaviors. Once I moved out of the dorms I became even more obsessed with my health since now I could cook all my own meals. This was the first time I could go to the grocery store and get what I wanted to eat, not just what was available to me. I would feel so guilty spending money on junk food that eventually I stopped. I would only buy whole foods (fresh produce and no freezer meals kinda thing). I cut dairy out of my diet completely, and slowly started cutting meat out as well. Now, the only meat I eat is chicken. Everything I do just looks like me being healthy, but it's all I think about. I can't bring myself to finish a meal anymore. I worry about the calories I'm eating before even swallowing my food. I cant make a non-whole-food food purchase without comparing nutrition facts and reading labels. I can tell you the protein, fat, and carbohydrate content of most foods just from memory. It's not even about losing weight anymore, I can see my rib cage just looking in the mirror and that not what I want. I just wanted to be healthy and it's completely taken over my life. I used to think I was being dramatic, or faking an eating disorder; but how can I be faking something if I don't talk to anyone about it and suffer alone? I don't know how to get out of this cycle, but I haven't enjoyed food in at least 5 years. It is such a struggle to put any food in my mouth without considering what it might do to my body; either the image or just my health in general. I'm anemic (maybe I should take iron pills?), my hair is falling out (but is it just the bleach?), I've lost all interest in the things I used to care about (maybe I'm just depressed?), I avoid going out to eat with my friends because menus don't have the nutrition labels for every ingredient available. My god I think I suffer from orthorexia, but it's almost as if I don't want to change because that change scares me more. Does anyone understand what I am saying here...?",1618424698.0
Struggling,10,gt4zd2,Orthorexia,https://www.reddit.com/r/Orthorexia/comments/gt4zd2/struggling/,1,"Hi!!Is there anybody struggling with ortorexia here?Because I live in a country where my family is not,I am ill and I don’t know how to heal",1590799856.0
Music video dealing with ED,6,gsqlqr,Orthorexia,https://www.reddit.com/r/Orthorexia/comments/gsqlqr/music_video_dealing_with_ed/,2,"Hi all! 
So I’ve recently released my first music video, called ‘Use me’. It deals with bulimia, struggling to conform to the increasing pressures of society, drugs, mental health and fun things like that.
I was formerly a high fashion model, which massively fucked me up, and I suffered with anorexia and then bulimia. I later bought my way out of my contract as I recognised I was no longer willing to, quite literally, change myself for other people.
I remember my bulimic / anorexic days so well. Food was all I thought about. It ruled my life. I was scared of bread. Hunger heightened my anxiety. I couldn’t imagine time where I would never NOT think about food.
But that time did come. And it’s such a good time.
My latest BTS from this music video discusses more. By all means check it out. I’ll post the music video and the BTS below.
I’m here to help spread the word and also help anyone out who needs to talk. I currently sponsor someone in OA (over eaters anonymous- but also deals with anorexia etc). 
All the best to you.
Emma

MUSIC VIDEO

https://youtu.be/dg65cyPNJM4

BTS (the fashion industry, ED and so on), live at 2pm GMT


https://youtu.be/2RXEJCejPa8",1590748936.0
Orthorexia: The Rarely Talked About Eating Disorder,16,fehb69,Orthorexia,https://i.redd.it/84xtjbbb03l41.jpg,0,,1583517507.0
GI Disorders and ED,10,fcfiaj,Orthorexia,https://www.reddit.com/r/Orthorexia/comments/fcfiaj/gi_disorders_and_ed/,5,"Hi all. I’m happy to have discovered this term. I’ve had fairly severe IBS since I was 10 years old- started with stomach aches, bloating, constipation and never feeling like I could fully finish going to the bathroom. 

I was put on strict elimination diets starting that age. At 27 I’m STILL struggling and trying to find the right adjustments/lifestyle management/meds for my condition. But I’ve been on the Candida diet (kind of like keto but with noooo sugar) since last April. It’s ideally meant to be a short term diet but even with a doctors supervision I have been instructed to stay on it.

I def struggled with disordered eating and calorie/health obsession as a teen, I thought I had mostly gotten past that but I’m not so sure I have. It’s so hard to be balanced when you’re medically supposed to be on a limited diet but also know that you take things to the extreme and are an obsessive type. I also really struggle with new doctors casually telling me like “try low fodmap, try cuz diet” because they don’t know all that I’ve been through. 

My relationship with food is so turbulent and my GI is still such a wreck it’s hard to picture things changing.",1583170030.0
