title,score,id,subreddit,url,num_comments,body,created
Interview for Article on Orthorexia,2,et0w89,Orthorexia,https://www.reddit.com/r/Orthorexia/comments/et0w89/interview_for_article_on_orthorexia/,2,"Hello everyone,

My name is Taylor Saathoff and I am a university student writing an article on orthorexia nervosa--with the possibility of being published--to draw attention to it and its importance. In order to get readers to truly gain an understanding of orthorexia, I would like to share the story of a person (or a few people) with orthorexia. I know that this could be difficult to do; however, I believe that personal stories like your own could be beneficial to someone else going through something similar. Please message me or reply to this post if you are interested in doing an interview. Thank you for your time, I look forward to hearing from you!",1579819586.0
Keto orthorexia,6,ep96n9,Orthorexia,https://www.reddit.com/r/Orthorexia/comments/ep96n9/keto_orthorexia/,6,Is anyone here on the keto diet and struggle with an ED? I'm a stay at home mom and just want someone to talk to ):,1579125442.0
The Truth About Orthorexia - Is Veganism An Eating Disorder?,5,cumww6,Orthorexia,https://www.youtube.com/watch?v=mV5iZU2jxmE,0,,1566609111.0
How I ended my food obsession,11,co2u91,Orthorexia,https://www.reddit.com/r/Orthorexia/comments/co2u91/how_i_ended_my_food_obsession/,0,"Hello Orthorexia Reddit,

About 2 years ago I decided to become a vegan. Throughout that time, my eating habits have changed greatly. However, this was partly because eating and learning about food became my new pass-time. In retrospect, I don't blame myself -- this insecurity was like a doctor who puts itself out of business.

I went through various stages in eating and beliefs about eating. I initially tried making omnivore favorites: tacos, chili, marinated chickens, burgers, and baked potatoes. Soon, my research on food led me to partially and finally completely restrict myself from artificial meats and other foods.

I found myself reading the 811 diet manifesto. I seriously doubted what the author was saying, but I still tried it. I actually liked being on the diet. I lost weight, which I didn't need; stopped caring about food, and enjoyed making meals. I only ate when I was hungry and ate smaller portions when pressured.

After becoming almost emaciated on this plan, I decided to eat normally again. However, I then developed extremely impulsive behavior, especially during my semester. If there was a food I liked, or leftovers, or anything, I would eat all of it. I started having these piercing headaches that occurred by the middle of the day. Then, I would obsess over food and overeat, which induced further headache and further overeating. I would eat so much that I couldn't do basic yoga.

However, this headache and my subsequent my obsession wasn't uncalled for. I was looking for answers, and I found *the ultimate* culprit for this obsession. My years of recollection about what I ate played a central role in this. These headaches only began after I ate a salty lunch, but no salty breakfast. For most of my time, I wouldn't feel the headache because I had a salty breakfast. So, whether it be the salt from your can of beans or slice of bread, it made me very concerned about food throughout the day and ultimately overeat. I should've known when I habitually started eating an entire box of Ezekiel cereal!

It then made sense, then, why I enjoyed a nearly fruitarian diet: there's almost no added salt. Since eliminating salt, all food worries of mine have gone away. My productivity and happiness have vastly improved, and I can focus on more pressing issues in my life.

If you have orthorexia or think you have orthorexia, please consider removing salt from your diet. It seems counter-intuitive to restrict the restricted further, but health and the obsession over health are separate. For me to realize this, I discovered that nutrition, weight, and food needed to be secondary to my mental health. But, in focusing on that, I believe that I now have better health overall.

Surprisingly, my experience with uncontrollable appetite under salt is shared by Russian cosmonauts: [https://www.webmd.com/diet/obesity/news/20170501/salt-weight-connection](https://www.webmd.com/diet/obesity/news/20170501/salt-weight-connection)",1565359574.0
How to help my boyfriend,3,986dvb,Orthorexia,https://www.reddit.com/r/Orthorexia/comments/986dvb/how_to_help_my_boyfriend/,2,"Hi,

I haven't been diagnosed but it is pretty clear that I have orthorexia and some anorexic traits. My boyfriend is aware of this and goes above and beyond to help me. However, he doesn't understand and I'm not sure of a good way to explain to him?

He also feels helpless because he can't help me and it frustrates him so I was wondering if anyone was in a similar position to him able to offer advice?

It's really driving a wedge between us and ruining us :( thank you.

",1534542813.0
"What is orthorexia, and does your clean eating obsession mean you have it?",2,856rvy,Orthorexia,https://www.yahoo.com/lifestyle/orthorexia-clean-eating-obsession-mean-180333568.html,1,,1521321650.0
Original Orthorexia Essay. Steve Bratman. (1997),1,36yj8t,Orthorexia,http://www.orthorexia.com/original-orthorexia-essay/,0,,1432357119.0
What is Orthorexia?,1,36yiob,Orthorexia,http://www.orthorexia.com/what-is-orthorexia/,0,,1432356727.0
